{"count":1,"next":null,"previous":null,"results":[{"id":8277,"game_id":12186,"game_slug":"the-sims-2","name":"The Sims 2","year":2004,"user":"citrusalex","runner":"wine","slug":"the-sims-2-wined3d-origin","version":"WineD3D | Origin","description":"This installer uses a patched version of wine that allows it to run The Sims 2, and also adds certain mods to fix Wine-specific issues with the game.It is made for the Ultimate Collection version from Origin.","notes":"IMPORTANT: READ THE MANUAL AND INSTALL DEPENDENCIES!\r\nSee <a href=\"https://github.com/lutris/lutris/wiki/Game:-The-Sims-2\">https://github.com/lutris/lutris/wiki/Game:-The-Sims-2</a>\r\n\r\n- The game will fail to launch with Origin-In-Game enabled. Please disable it in Origin's preferences to launch The Sims 2.\r\n- For support, contact @Tannis Root on Linux Gamers Group server.","created_at":"2018-05-13T16:03:22.762000Z","updated_at":"2019-11-07T08:35:41.818873Z","draft":false,"published":false,"published_by":51687,"rating":"3","steamid":null,"gogid":null,"gogslug":"","humblestoreid":"","script":{"installer":[{"task":{"prefix":"$GAMEDIR","description":"Creating Wine Prefix...","arch":"win32","name":"create_prefix"}},{"task":{"prefix":"$GAMEDIR","description":"Disabling crash dialogs...","arch":"win32","type":"REG_DWORD","value":0,"path":"HKEY_CURRENT_USER\\Software\\Wine\\WineDbg","key":"ShowCrashDialog","name":"set_regedit"}},{"task":{"prefix":"$GAMEDIR","description":"Setting version to xp...","arch":"win32","key":"Version","value":"winxp","path":"HKEY_CURRENT_USER\\Software\\Wine","name":"set_regedit"}},{"task":{"prefix":"$GAMEDIR","description":"Setting Vertex Shader Model to 2...","arch":"win32","type":"REG_DWORD","value":"00000002","path":"HKEY_CURRENT_USER\\Software\\Wine\\Direct3D","key":"MaxShaderModelVS","name":"set_regedit"}},{"task":{"prefix":"$GAMEDIR","description":"Setting Pixel Shader Model to 2...","arch":"win32","type":"REG_DWORD","value":"00000002","path":"HKEY_CURRENT_USER\\Software\\Wine\\Direct3D","key":"MaxShaderModelPS","name":"set_regedit"}},{"task":{"prefix":"$GAMEDIR","name":"winekill"}},{"task":{"prefix":"$GAMEDIR","description":"Installing Vcrun 2013","arch":"win32","app":"vcrun2013","silent":true,"name":"winetricks"}},{"task":{"prefix":"$GAMEDIR","description":"Installing Vcrun 2010","arch":"win32","app":"vcrun2010","silent":true,"name":"winetricks"}},{"extract":{"dst":"$GAMEDIR/drive_c/users/$USER/My Documents/EA Games/The Sims™ 2 Ultimate Collection/Downloads","file":"fixes"}},{"write_file":{"content":"boolprop useshaders true\nboolProp   createNVidiaWorkaroundTexture false\nboolProp   bumpMapping false\n","file":"$GAMEDIR/drive_c/users/$USER/My Documents/EA Games/The Sims™ 2 Ultimate Collection/Config/userstartup.cheat"}},{"task":{"prefix":"$GAMEDIR","name":"winekill"}},{"task":{"executable":"origin","prefix":"$GAMEDIR","description":"Installing Origin...","arch":"win32","exclude_processes":"Origin.exe OriginClientService.exe","name":"wineexec"}},{"task":{"prefix":"$GAMEDIR","name":"winekill"}}],"game":{"prefix":"$GAMEDIR","exe":"drive_c/Program Files/Origin/Origin.exe","arch":"win32"},"system":{"env":{"WINE_LARGE_ADDRESS_AWARE":1}},"wine":{"version":"tkg-sims2-3.21-x86_64"},"files":[{"fixes":"https://github.com/tannisroot/installer-fixes/raw/master/sims2_fixes.tar.xz"},{"origin":"https://origin-a.akamaihd.net/Origin-Client-Download/origin/legacy/OriginThinSetup.exe"}]},"content":"files:\r\n- fixes: https://github.com/tannisroot/installer-fixes/raw/master/sims2_fixes.tar.xz\r\n- origin: https://origin-a.akamaihd.net/Origin-Client-Download/origin/legacy/OriginThinSetup.exe\r\ngame:\r\n  arch: win32\r\n  exe: drive_c/Program Files/Origin/Origin.exe\r\n  prefix: $GAMEDIR\r\ninstaller:\r\n- task:\r\n    arch: win32\r\n    description: Creating Wine Prefix...\r\n    name: create_prefix\r\n    prefix: $GAMEDIR\r\n- task:\r\n    arch: win32\r\n    description: Disabling crash dialogs...\r\n    key: ShowCrashDialog\r\n    name: set_regedit\r\n    path: HKEY_CURRENT_USER\\Software\\Wine\\WineDbg\r\n    prefix: $GAMEDIR\r\n    type: REG_DWORD\r\n    value: 0\r\n- task:\r\n    arch: win32\r\n    description: Setting version to xp...\r\n    key: Version\r\n    name: set_regedit\r\n    path: HKEY_CURRENT_USER\\Software\\Wine\r\n    prefix: $GAMEDIR\r\n    value: winxp\r\n- task:\r\n    arch: win32\r\n    description: Setting Vertex Shader Model to 2...\r\n    key: MaxShaderModelVS\r\n    name: set_regedit\r\n    path: HKEY_CURRENT_USER\\Software\\Wine\\Direct3D\r\n    prefix: $GAMEDIR\r\n    type: REG_DWORD\r\n    value: '00000002'\r\n- task:\r\n    arch: win32\r\n    description: Setting Pixel Shader Model to 2...\r\n    key: MaxShaderModelPS\r\n    name: set_regedit\r\n    path: HKEY_CURRENT_USER\\Software\\Wine\\Direct3D\r\n    prefix: $GAMEDIR\r\n    type: REG_DWORD\r\n    value: '00000002'\r\n- task:\r\n    name: winekill\r\n    prefix: $GAMEDIR\r\n- task:\r\n    app: vcrun2013\r\n    arch: win32\r\n    description: Installing Vcrun 2013\r\n    name: winetricks\r\n    prefix: $GAMEDIR\r\n    silent: true\r\n- task:\r\n    app: vcrun2010\r\n    arch: win32\r\n    description: Installing Vcrun 2010\r\n    name: winetricks\r\n    prefix: $GAMEDIR\r\n    silent: true\r\n- extract:\r\n    dst: \"$GAMEDIR/drive_c/users/$USER/My Documents/EA Games/The Sims\\u2122 2 Ultimate\\\r\n      \\ Collection/Downloads\"\r\n    file: fixes\r\n- write_file:\r\n    content: 'boolprop useshaders true\r\n\r\n      boolProp   createNVidiaWorkaroundTexture false\r\n\r\n      boolProp   bumpMapping false\r\n\r\n      '\r\n    file: \"$GAMEDIR/drive_c/users/$USER/My Documents/EA Games/The Sims\\u2122 2 Ultimate\\\r\n      \\ Collection/Config/userstartup.cheat\"\r\n- task:\r\n    name: winekill\r\n    prefix: $GAMEDIR\r\n- task:\r\n    arch: win32\r\n    description: Installing Origin...\r\n    exclude_processes: Origin.exe OriginClientService.exe\r\n    executable: origin\r\n    name: wineexec\r\n    prefix: $GAMEDIR\r\n- task:\r\n    name: winekill\r\n    prefix: $GAMEDIR\r\nsystem:\r\n  env:\r\n    WINE_LARGE_ADDRESS_AWARE: 1\r\nwine:\r\n  version: tkg-sims2-3.21-x86_64"}]}